root@comp3134:~# tcpdump -n -i eth0
tcpdump: verbose output suppressed, use -v[v]... for full protocol decode
listening on eth0, link-type EN10MB (Ethernet), snapshot length 262144 bytes
22:15:50.894912 IP 143.198.47.235.22 > 184.146.217.126.49898: Flags [P.], seq 1908475837:1908476025, ack 1352991933, win 1526, length 188
22:15:50.906381 IP 184.146.217.126.49898 > 143.198.47.235.22: Flags [.], ack 188, win 2043, length 0
22:15:50.906382 IP 184.146.217.126.49898 > 143.198.47.235.22: Flags [P.], seq 1:37, ack 188, win 2043, length 36
22:15:50.906558 IP 143.198.47.235.22 > 184.146.217.126.49898: Flags [P.], seq 188:224, ack 37, win 1526, length 36
22:15:50.934359 IP 184.146.217.126.49898 > 143.198.47.235.22: Flags [P.], seq 37:73, ack 224, win 2043, length 36
22:15:50.934540 IP 143.198.47.235.22 > 184.146.217.126.49898: Flags [P.], seq 224:260, ack 73, win 1526, length 36
22:15:50.952333 IP 184.146.217.126.49898 > 143.198.47.235.22: Flags [P.], seq 73:109, ack 260, win 2043, length 36
22:15:50.952481 IP 143.198.47.235.22 > 184.146.217.126.49898: Flags [P.], seq 260:296, ack 109, win 1526, length 36
22:15:50.977350 IP 184.146.217.126.49898 > 143.198.47.235.22: Flags [P.], seq 109:145, ack 296, win 2043, length 36
22:15:50.977510 IP 143.198.47.235.22 > 184.146.217.126.49898: Flags [P.], seq 296:332, ack 145, win 1526, length 36
22:15:50.991646 IP 143.198.47.235.22 > 184.146.217.126.49898: Flags [P.], seq 332:1536, ack 145, win 1526, length 1204
22:15:50.997420 IP 184.146.217.126.49898 > 143.198.47.235.22: Flags [P.], seq 145:181, ack 332, win 2043, length 36
22:15:50.997594 IP 143.198.47.235.22 > 184.146.217.126.49898: Flags [P.], seq 1536:1572, ack 181, win 1526, length 36
22:15:51.004365 IP 184.146.217.126.49898 > 143.198.47.235.22: Flags [.], ack 1536, win 2047, length 0
22:15:51.008369 IP 184.146.217.126.49898 > 143.198.47.235.22: Flags [.], ack 1572, win 2047, length 0
22:15:51.025361 IP 184.146.217.126.49898 > 143.198.47.235.22: Flags [P.], seq 181:217, ack 1572, win 2047, length 36
22:15:51.025537 IP 143.198.47.235.22 > 184.146.217.126.49898: Flags [P.], seq 1572:1608, ack 217, win 1526, length 36
22:15:51.055418 IP 184.146.217.126.49898 > 143.198.47.235.22: Flags [P.], seq 217:253, ack 1608, win 2047, length 36
22:15:51.055605 IP 143.198.47.235.22 > 184.146.217.126.49898: Flags [P.], seq 1608:1644, ack 253, win 1526, length 36
22:15:51.087367 IP 184.146.217.126.49898 > 143.198.47.235.22: Flags [P.], seq 253:289, ack 1644, win 2047, length 36
22:15:51.087553 IP 143.198.47.235.22 > 184.146.217.126.49898: Flags [P.], seq 1644:1680, ack 289, win 1526, length 36
22:15:51.095474 IP 143.198.47.235.22 > 184.146.217.126.49898: Flags [P.], seq 1680:1836, ack 289, win 1526, length 156
22:15:51.095811 IP 143.198.47.235.22 > 184.146.217.126.49898: Flags [P.], seq 1836:3024, ack 289, win 1526, length 1188
22:15:51.119362 IP 184.146.217.126.49898 > 143.198.47.235.22: Flags [P.], seq 289:325, ack 1680, win 2047, length 36
22:15:51.119535 IP 143.198.47.235.22 > 184.146.217.126.49898: Flags [P.], seq 3024:3060, ack 325, win 1526, length 36
22:15:51.124325 IP 184.146.217.126.49898 > 143.198.47.235.22: Flags [.], ack 3024, win 2047, length 0
22:15:51.148347 IP 184.146.217.126.49898 > 143.198.47.235.22: Flags [P.], seq 325:361, ack 3060, win 2047, length 36
22:15:51.148494 IP 143.198.47.235.22 > 184.146.217.126.49898: Flags [P.], seq 3060:3096, ack 361, win 1526, length 36
22:15:51.183357 IP 184.146.217.126.49898 > 143.198.47.235.22: Flags [P.], seq 361:397, ack 3096, win 2047, length 36
22:15:51.183552 IP 143.198.47.235.22 > 184.146.217.126.49898: Flags [P.], seq 3096:3132, ack 397, win 1526, length 36
22:15:51.199567 IP 143.198.47.235.22 > 184.146.217.126.49898: Flags [P.], seq 3132:4224, ack 397, win 1526, length 1092
22:15:51.219411 IP 184.146.217.126.49898 > 143.198.47.235.22: Flags [P.], seq 397:433, ack 3132, win 2047, length 36
22:15:51.219604 IP 143.198.47.235.22 > 184.146.217.126.49898: Flags [P.], seq 4224:4260, ack 433, win 1526, length 36
22:15:51.232361 IP 184.146.217.126.49898 > 143.198.47.235.22: Flags [.], ack 4260, win 2043, length 0
22:15:51.233303 IP 184.146.217.126.49898 > 143.198.47.235.22: Flags [P.], seq 433:469, ack 4260, win 2043, length 36
22:15:51.233461 IP 143.198.47.235.22 > 184.146.217.126.49898: Flags [P.], seq 4260:4296, ack 469, win 1526, length 36
22:15:51.257338 IP 184.146.217.126.49898 > 143.198.47.235.22: Flags [P.], seq 469:505, ack 4296, win 2043, length 36
22:15:51.257535 IP 143.198.47.235.22 > 184.146.217.126.49898: Flags [P.], seq 4296:4332, ack 505, win 1526, length 36
22:15:51.288342 IP 184.146.217.126.49898 > 143.198.47.235.22: Flags [P.], seq 505:541, ack 4332, win 2042, length 36
22:15:51.288500 IP 143.198.47.235.22 > 184.146.217.126.49898: Flags [P.], seq 4332:4368, ack 541, win 1526, length 36
^C
40 packets captured
45 packets received by filter
0 packets dropped by kernel
